{
  "$schema": "https://json-schema.org/draft/2020-12/schema",
  "$id": "https://snds.workspace/schemas/skills.registry.schema.json",
  "title": "skills.registry.json — the routing + dependency graph",
  "description": "Generated from SKILL.md frontmatter by 09-tools/build-registry.py. Never hand-edit. Encodes how any agent computes the ordered skill load set for a request. See AGENTS.md 'Skill loading precedence' and 01-shared-references/skill-frontmatter.md.",
  "type": "object",
  "required": ["registry_version", "spec_version", "generated_from", "skills", "load_chains"],
  "additionalProperties": true,
  "properties": {
    "registry_version": { "type": "string", "description": "Shape of this file." },
    "spec_version": { "type": "string", "description": "Frontmatter contract version this was built against." },
    "generated_from": { "const": "frontmatter" },
    "tier_rank": {
      "type": "object",
      "description": "Load-order rank per tier; lower loads first.",
      "additionalProperties": { "type": "integer" }
    },
    "counts": {
      "type": "object",
      "properties": {
        "total": { "type": "integer" },
        "by_tier": { "type": "object", "additionalProperties": { "type": "integer" } }
      }
    },
    "skills": {
      "type": "object",
      "description": "skill-name -> record",
      "additionalProperties": {
        "type": "object",
        "required": ["path"],
        "properties": {
          "path": { "type": "string", "description": "Workspace-relative path to the SKILL.md." },
          "tier": {
            "type": ["string", "null"],
            "enum": ["foundation", "hub", "spoke", "cross-cutting", null],
            "description": "Load class. null = not yet migrated to frontmatter v2."
          },
          "domain": { "type": ["string", "null"] },
          "hub": { "type": ["string", "null"], "description": "Parent hub (spoke -> hub edge)." },
          "prerequisites": {
            "type": "array", "items": { "type": "string" },
            "description": "Hard load-before edges. The resolver walks these transitively to roots."
          },
          "related": {
            "type": "array", "items": { "type": "string" },
            "description": "Soft cross-references. Surfaced as suggestions, never auto-loaded."
          },
          "governed_by": {
            "type": "array", "items": { "type": "string" },
            "description": "Cross-cutting lenses (a11y, visual-qa) applied after this skill produces output."
          },
          "governs": { "type": "array", "items": { "type": "string" } },
          "triggers": {
            "type": "array", "items": { "type": "string" },
            "description": "Machine-readable routing keywords."
          },
          "surfaces": {
            "type": "array", "items": { "type": "string" },
            "description": "Where the skill is valid. ['*'] = all surfaces."
          },
          "hash": { "type": "string", "description": "sha256 of the SKILL.md for integrity/drift." }
        }
      }
    },
    "load_chains": {
      "type": "object",
      "description": "skill-name -> precomputed ordered ancestor+self list (foundations first). Lets a weak/offline agent skip the toposort.",
      "additionalProperties": {
        "type": "array",
        "items": { "type": "string" }
      }
    }
  }
}
