{
  "$schema": "./skills.registry.schema.json",
  "registry_version": "1.0",
  "spec_version": "2.0",
  "generated_from": "frontmatter",
  "tier_rank": {
    "foundation": 0,
    "hub": 1,
    "spoke": 2,
    "cross-cutting": 3
  },
  "counts": {
    "total": 199,
    "by_tier": {
      "unspecified": 199
    }
  },
  "skills": {
    "3d-asset-pipeline": {
      "path": "02-skills/3d-asset-pipeline/SKILL.md",
      "tier": null,
      "domain": null,
      "hub": "lead-3d-designer",
      "prerequisites": [],
      "related": [],
      "governed_by": [],
      "governs": [],
      "triggers": [],
      "surfaces": [
        "*"
      ],
      "hash": "sha256:b15ea7dba369eea9d835c4a6fcc72173318731c76fcc6321e64bb8793a82c5d2"
    },
    "3d-lighting-rendering": {
      "path": "02-skills/3d-lighting-rendering/SKILL.md",
      "tier": null,
      "domain": null,
      "hub": "lead-3d-designer",
      "prerequisites": [],
      "related": [],
      "governed_by": [],
      "governs": [],
      "triggers": [],
      "surfaces": [
        "*"
      ],
      "hash": "sha256:4d1dc99bdabda31ba4d61bde32e60c6aa2126d6ab14862872afa42ba312d7e29"
    },
    "3d-materials-shading": {
      "path": "02-skills/3d-materials-shading/SKILL.md",
      "tier": null,
      "domain": null,
      "hub": "lead-3d-designer",
      "prerequisites": [],
      "related": [],
      "governed_by": [],
      "governs": [],
      "triggers": [],
      "surfaces": [
        "*"
      ],
      "hash": "sha256:2ccdc09e5382f38e6ea7e504855e0a2d0a8799101ccc00c240ac462f4dd366fd"
    },
    "3d-modeling-fundamentals": {
      "path": "02-skills/3d-modeling-fundamentals/SKILL.md",
      "tier": null,
      "domain": null,
      "hub": "lead-3d-designer",
      "prerequisites": [],
      "related": [],
      "governed_by": [],
      "governs": [],
      "triggers": [],
      "surfaces": [
        "*"
      ],
      "hash": "sha256:28db78e81afa75b2d8a1904c2590aae30603671ce4ce9f1e68faac86cce6a480"
    },
    "3d-rigging-animation": {
      "path": "02-skills/3d-rigging-animation/SKILL.md",
      "tier": null,
      "domain": null,
      "hub": "lead-3d-designer",
      "prerequisites": [],
      "related": [],
      "governed_by": [],
      "governs": [],
      "triggers": [],
      "surfaces": [
        "*"
      ],
      "hash": "sha256:ecf05aef7a6ebec3183afc3fe62cdf32e295383704312d1e7c28210a0c7a1027"
    },
    "3d-spatial-design-for-games": {
      "path": "02-skills/3d-spatial-design-for-games/SKILL.md",
      "tier": null,
      "domain": null,
      "hub": "lead-3d-designer",
      "prerequisites": [],
      "related": [],
      "governed_by": [],
      "governs": [],
      "triggers": [],
      "surfaces": [
        "*"
      ],
      "hash": "sha256:b569292c37f69108af8e43726603a8f50f569af9d25f8e8935b9b2c672ef982e"
    },
    "a11y-assistive-tech": {
      "path": "02-skills/a11y-assistive-tech/SKILL.md",
      "tier": null,
      "domain": null,
      "hub": null,
      "prerequisites": [],
      "related": [],
      "governed_by": [],
      "governs": [],
      "triggers": [],
      "surfaces": [
        "*"
      ],
      "hash": "sha256:886537d3aeabc7b7818d90f63bb38c173c615b3a31f6cc1cf3e9d7d222420ee0"
    },
    "a11y-auditory": {
      "path": "02-skills/a11y-auditory/SKILL.md",
      "tier": null,
      "domain": null,
      "hub": null,
      "prerequisites": [],
      "related": [],
      "governed_by": [],
      "governs": [],
      "triggers": [],
      "surfaces": [
        "*"
      ],
      "hash": "sha256:3d69808ce94fd8d56c396d9a0ff347ff02c719c3effceed4b045f295cd74b116"
    },
    "a11y-cognitive": {
      "path": "02-skills/a11y-cognitive/SKILL.md",
      "tier": null,
      "domain": null,
      "hub": null,
      "prerequisites": [],
      "related": [],
      "governed_by": [],
      "governs": [],
      "triggers": [],
      "surfaces": [
        "*"
      ],
      "hash": "sha256:0bbb0eec856953cd9a3b36b1a57beeabb77fff78b1a18710df6c90f50d5c5978"
    },
    "a11y-legal-compliance": {
      "path": "02-skills/a11y-legal-compliance/SKILL.md",
      "tier": null,
      "domain": null,
      "hub": null,
      "prerequisites": [],
      "related": [],
      "governed_by": [],
      "governs": [],
      "triggers": [],
      "surfaces": [
        "*"
      ],
      "hash": "sha256:5ac74da6614980ee4973cb173d54c56a9eba945361718cff76e1a8843127b5cc"
    },
    "a11y-motor-physical": {
      "path": "02-skills/a11y-motor-physical/SKILL.md",
      "tier": null,
      "domain": null,
      "hub": null,
      "prerequisites": [],
      "related": [],
      "governed_by": [],
      "governs": [],
      "triggers": [],
      "surfaces": [
        "*"
      ],
      "hash": "sha256:1c0ea59bc5e4f518d80c2befe6c87051c856dac8027a7711d38135e2277cd35b"
    },
    "a11y-neurodiversity": {
      "path": "02-skills/a11y-neurodiversity/SKILL.md",
      "tier": null,
      "domain": null,
      "hub": null,
      "prerequisites": [],
      "related": [],
      "governed_by": [],
      "governs": [],
      "triggers": [],
      "surfaces": [
        "*"
      ],
      "hash": "sha256:0fd20043e4ce490b0da43334d7ada80875dd2f1804d2b58428e241bc7ec6488e"
    },
    "a11y-visual": {
      "path": "02-skills/a11y-visual/SKILL.md",
      "tier": null,
      "domain": null,
      "hub": null,
      "prerequisites": [],
      "related": [],
      "governed_by": [],
      "governs": [],
      "triggers": [],
      "surfaces": [
        "*"
      ],
      "hash": "sha256:a1218f44204cb564d7c64cc78b6aa62cfe4b92cc79e60f3ed777e8a9892c6002"
    },
    "be-api-design": {
      "path": "02-skills/be-api-design/SKILL.md",
      "tier": null,
      "domain": null,
      "hub": null,
      "prerequisites": [],
      "related": [],
      "governed_by": [],
      "governs": [],
      "triggers": [],
      "surfaces": [
        "*"
      ],
      "hash": "sha256:323dd3ae8fda3fb1dd6418bc36a4c1be9bc96e340b6fdecd0a9762ca3be59341"
    },
    "be-auth-patterns": {
      "path": "02-skills/be-auth-patterns/SKILL.md",
      "tier": null,
      "domain": null,
      "hub": null,
      "prerequisites": [],
      "related": [],
      "governed_by": [],
      "governs": [],
      "triggers": [],
      "surfaces": [
        "*"
      ],
      "hash": "sha256:4f4c5af6e4824f7b952a98dd67c7388000a436b90788048fec5906873fbd6782"
    },
    "be-caching-performance": {
      "path": "02-skills/be-caching-performance/SKILL.md",
      "tier": null,
      "domain": null,
      "hub": null,
      "prerequisites": [],
      "related": [],
      "governed_by": [],
      "governs": [],
      "triggers": [],
      "surfaces": [
        "*"
      ],
      "hash": "sha256:04880b545bb9b16c35b8d3689b6e9df7f33c19a1da2e77a9fb0a83e008e823e4"
    },
    "be-data-modeling": {
      "path": "02-skills/be-data-modeling/SKILL.md",
      "tier": null,
      "domain": null,
      "hub": null,
      "prerequisites": [],
      "related": [],
      "governed_by": [],
      "governs": [],
      "triggers": [],
      "surfaces": [
        "*"
      ],
      "hash": "sha256:07cca61e862f8ad567a417cc65f740f77a78df36cb300144d958fa2997cedda8"
    },
    "be-integration-patterns": {
      "path": "02-skills/be-integration-patterns/SKILL.md",
      "tier": null,
      "domain": null,
      "hub": null,
      "prerequisites": [],
      "related": [],
      "governed_by": [],
      "governs": [],
      "triggers": [],
      "surfaces": [
        "*"
      ],
      "hash": "sha256:c75bc7225636d83bdb0a6c8724cfa5b3744fb9a30def6e21a28b393c8ab19ba8"
    },
    "be-relational-db": {
      "path": "02-skills/be-relational-db/SKILL.md",
      "tier": null,
      "domain": null,
      "hub": null,
      "prerequisites": [],
      "related": [],
      "governed_by": [],
      "governs": [],
      "triggers": [],
      "surfaces": [
        "*"
      ],
      "hash": "sha256:9973bf90ec4ed29ff10036e2257ced5c01bbf3ce6e6b41b43b5c5142699bc4e4"
    },
    "be-security-posture": {
      "path": "02-skills/be-security-posture/SKILL.md",
      "tier": null,
      "domain": null,
      "hub": "lead-backend-engineer",
      "prerequisites": [],
      "related": [],
      "governed_by": [],
      "governs": [],
      "triggers": [],
      "surfaces": [
        "*"
      ],
      "hash": "sha256:4749ce70f8ae97d6f5cb472ab10d439a5d73c49c3c7eb2a419867ff6cdd3e15d"
    },
    "be-service-architecture": {
      "path": "02-skills/be-service-architecture/SKILL.md",
      "tier": null,
      "domain": null,
      "hub": null,
      "prerequisites": [],
      "related": [],
      "governed_by": [],
      "governs": [],
      "triggers": [],
      "surfaces": [
        "*"
      ],
      "hash": "sha256:ee2d282430042c8731de76e1ca374c665e17a80535c34b997f72109b64eba535"
    },
    "centric-ui-storybook": {
      "path": "02-skills/centric-ui-storybook/SKILL.md",
      "tier": null,
      "domain": null,
      "hub": null,
      "prerequisites": [],
      "related": [],
      "governed_by": [],
      "governs": [],
      "triggers": [],
      "surfaces": [
        "*"
      ],
      "hash": "sha256:e9318caf0b363df3347f8d335d4c5184a456e90915806af62f21663bb0475fe6"
    },
    "centric-ui-workflow": {
      "path": "02-skills/centric-ui-workflow/SKILL.md",
      "tier": null,
      "domain": null,
      "hub": null,
      "prerequisites": [],
      "related": [],
      "governed_by": [],
      "governs": [],
      "triggers": [],
      "surfaces": [
        "*"
      ],
      "hash": "sha256:79f47b9b5a84298f4a9173576e3aabcf6b8a5c26a8fe1f8145614254bd771efc"
    },
    "cowork-skills-sync": {
      "path": "02-skills/cowork-skills-sync/SKILL.md",
      "tier": null,
      "domain": null,
      "hub": null,
      "prerequisites": [],
      "related": [],
      "governed_by": [],
      "governs": [],
      "triggers": [],
      "surfaces": [
        "*"
      ],
      "hash": "sha256:7774a6260de2e8c674b091fcdb559b89c298df18de8b2c9a229557e396e1946c"
    },
    "design-engineer": {